{
  "$schema": "./decision-matrix.schema.json",
  "id": "resilience-iq.decision-matrix",
  "version": "2.0.0-design",
  "statusAsOf": "2026-10-27",
  "author": "resilience-lead (AI practice-lead agent). Advises; the product owner approves (gate RQ1).",
  "ownerDecision": "D3 accepted by the product owner on 27 Oct 2026: written ladder, the higher of the RTO and RPO rungs; DR-05 only for RTO under 15 minutes with near-zero RPO, shown beside DR-04 as a business choice; modifiers add controls, not rungs.",
  "note": "Replaces resilience-iq/design/decision-matrix.json (S1-S5, not read by the engine) and the pattern bonuses in runtime.ts:586-591. In RQ3 this file moves to resilience-iq/knowledge/ and becomes the only source of the recommended rung. Band edges are LTM judgements grounded in the provider guidance cited; each carries its basis and status. Claim ids assigned in RQ2 (28 Oct 2026).",
  "rungs": [
    {
      "id": "DR-01",
      "rank": 1,
      "name": "Backup and restore",
      "plainName": "Backup and restore",
      "legacyLadderId": "S1",
      "definition": "Data and configuration are backed up to a separate location; on disaster the infrastructure is redeployed (ideally from code), the application deployed and the data restored.",
      "costOrder": 1,
      "providerEquivalents": [
        { "provider": "aws", "pattern": "Backup and restore", "rto": "24 hours or less", "rpo": "hours (point-in-time recovery can lower it to as low as 5 minutes in some cases)", "ref": "SRC-AWS-REL13", "status": "V" },
        { "provider": "azure", "pattern": "Backup and restore (Tier 3, Administrative)", "rto": "hours to days", "rpo": "hours", "ref": "SRC-AZ-DRGUIDE", "status": "V" },
        { "provider": "google_cloud", "pattern": "Cold", "rto": "no figure given (large RTO)", "rpo": "set by the last snapshot", "ref": "SRC-GCP-DRPLAN", "status": "V", "note": "Google gives no numeric bands; the mapping of cold to DR-01 is an LTM mapping." },
        { "provider": "on_premises", "pattern": "Restore to a cold site or rebuilt infrastructure", "ref": "SRC-NIST-80034", "status": "P", "note": "NIST SP 800-34 Rev. 1 describes cold, warm, hot and mirrored alternate sites; section not re-read." },
        { "provider": "sovereign_and_other", "pattern": "Provider backup service or customer-managed backup to a second location", "status": "LTM heuristic", "note": "Provider features found in discovery (playbook, RQ8)." }
      ],
      "basis": [
        { "ref": "SRC-AWS-REL13", "passage": "Backup and restore (RPO in hours, RTO in 24 hours or less)", "status": "V", "claim": "CLM-RES-002" },
        { "ref": "SRC-AZ-DRGUIDE", "passage": "Tier 3: RTO ranging from hours to days and RPO measured in hours; backup and restore", "status": "V", "claim": "CLM-RES-009" }
      ]
    },
    {
      "id": "DR-02",
      "rank": 2,
      "name": "Pilot light",
      "plainName": "Pilot light (data replicated, core services ready, compute started on failover)",
      "legacyLadderId": "S2",
      "definition": "Data is replicated to the recovery location and core infrastructure is provisioned; application compute is not running and is started and scaled on failover.",
      "costOrder": 2,
      "providerEquivalents": [
        { "provider": "aws", "pattern": "Pilot light", "rto": "tens of minutes", "rpo": "minutes", "ref": "SRC-AWS-REL13", "status": "V", "note": "AWS Elastic Disaster Recovery takes the pilot light approach with RPO in seconds and RTO in minutes; it is an option under DR-02 and DR-03, not DR-01 or DR-04." },
        { "provider": "azure", "pattern": "Active-passive (cold standby): secondary infrastructure and replication ready, compute stopped", "rto": "hours (Tier 2)", "rpo": "hours (Tier 2)", "ref": "SRC-AZ-DRGUIDE", "status": "V", "note": "Azure's 'cold standby' is closer to AWS pilot light than to backup and restore: data replication and infrastructure as code are in place, compute is stopped." },
        { "provider": "google_cloud", "pattern": "Warm (lower end)", "ref": "SRC-GCP-DRPLAN", "status": "V", "note": "Qualitative only; LTM mapping." },
        { "provider": "on_premises", "pattern": "Warm site with replicated data", "ref": "SRC-NIST-80034", "status": "P" },
        { "provider": "sovereign_and_other", "pattern": "Replication to a second region or site of the provider, compute on demand", "status": "LTM heuristic" }
      ],
      "basis": [
        { "ref": "SRC-AWS-REL13", "passage": "Pilot light (RPO in minutes, RTO in tens of minutes)", "status": "V", "claim": "CLM-RES-003" }
      ]
    },
    {
      "id": "DR-03",
      "rank": 3,
      "name": "Warm standby",
      "plainName": "Warm standby (a smaller copy always running)",
      "legacyLadderId": "S3",
      "definition": "A scaled-down but fully functional copy runs in the recovery location with live replicated data; on failover it is scaled up.",
      "costOrder": 3,
      "providerEquivalents": [
        { "provider": "aws", "pattern": "Warm standby", "rto": "minutes", "rpo": "seconds", "ref": "SRC-AWS-REL13", "status": "V" },
        { "provider": "azure", "pattern": "Active-passive (warm standby)", "rto": "minutes (Tier 1)", "rpo": "minutes (Tier 1)", "ref": "SRC-AZ-DRGUIDE", "status": "V", "note": "Azure Tier 1 uses 'a mix of active-active or warm standby'." },
        { "provider": "google_cloud", "pattern": "Warm", "ref": "SRC-GCP-DRPLAN", "status": "V", "note": "Qualitative only; LTM mapping." },
        { "provider": "on_premises", "pattern": "Warm or hot site with running reduced capacity", "ref": "SRC-NIST-80034", "status": "P" },
        { "provider": "sovereign_and_other", "pattern": "Reduced-capacity standby in a second region or site", "status": "LTM heuristic" }
      ],
      "basis": [
        { "ref": "SRC-AWS-REL13", "passage": "Warm standby (RPO in seconds, RTO in minutes)", "status": "V", "claim": "CLM-RES-004" }
      ]
    },
    {
      "id": "DR-04",
      "rank": 4,
      "name": "Hot standby (active-passive at full capacity)",
      "plainName": "Hot standby (a full-size copy ready to take over)",
      "legacyLadderId": "S4",
      "definition": "A full-capacity copy runs in the recovery location with live replicated data and automated or one-step failover; it does not serve production traffic until failover.",
      "costOrder": 4,
      "providerEquivalents": [
        { "provider": "aws", "pattern": "Hot standby (warm standby at full capacity)", "rto": "minutes, lower than warm standby", "rpo": "seconds", "ref": "SRC-AWS-REL13", "status": "V", "note": "AWS: 'When fully scaled this is known as hot standby'." },
        { "provider": "azure", "pattern": "Active-passive warm standby scaled to full capacity with automatic failover", "ref": "SRC-AZ-DRGUIDE", "status": "LTM heuristic", "note": "Azure has no separately named full-capacity active-passive pattern, and its glossary uses 'hot standby' for active-active. Terminology differs; the report names the pattern in words." },
        { "provider": "google_cloud", "pattern": "Hot (active-passive)", "ref": "SRC-GCP-DRPLAN", "status": "V", "note": "Qualitative only; LTM mapping." },
        { "provider": "on_premises", "pattern": "Hot site", "ref": "SRC-NIST-80034", "status": "P" },
        { "provider": "sovereign_and_other", "pattern": "Full-capacity standby in a second region or site", "status": "LTM heuristic" }
      ],
      "basis": [
        { "ref": "SRC-AWS-REL13", "passage": "The more scaled-up the warm standby is, the lower RTO and control plane reliance will be. When fully scales this is known as hot standby.", "status": "V", "claim": "CLM-RES-004" }
      ]
    },
    {
      "id": "DR-05",
      "rank": 5,
      "name": "Multi-site active-active",
      "plainName": "Active-active (two or more sites serving live traffic)",
      "legacyLadderId": "S5",
      "definition": "The service runs and serves traffic from two or more sites or regions at once, with data synchronised between them; a failed site is evacuated.",
      "costOrder": 5,
      "providerEquivalents": [
        { "provider": "aws", "pattern": "Multi-Region (multi-site) active-active", "rto": "potentially zero", "rpo": "near zero", "ref": "SRC-AWS-REL13", "status": "V", "note": "AWS: replication does not protect against data corruption or destruction unless point-in-time recovery is included." },
        { "provider": "azure", "pattern": "Active-active (Tier 0, Mission critical)", "rto": "seconds", "rpo": "approaching zero", "ref": "SRC-AZ-DRGUIDE", "status": "V" },
        { "provider": "google_cloud", "pattern": "Hot (HA across both environments)", "ref": "SRC-GCP-DRAPPS", "status": "V", "note": "Qualitative only." },
        { "provider": "on_premises", "pattern": "Mirrored sites", "ref": "SRC-NIST-80034", "status": "P" },
        { "provider": "sovereign_and_other", "pattern": "Active-active across regions or providers", "status": "LTM heuristic" }
      ],
      "basis": [
        { "ref": "SRC-AWS-REL13", "passage": "Multi-Region (multi-site) active-active (RPO near zero, RTO potentially zero) ... should only be selected when business requirements necessitate it.", "status": "V", "claim": "CLM-RES-005" }
      ]
    }
  ],
  "scales": {
    "rto": [
      { "answer": "<15 minutes", "minMinutes": 0, "maxMinutes": 15, "rung": "DR-04",
        "basis": [ { "ref": "SRC-AWS-REL13", "passage": "Warm standby RTO in minutes; hot standby lowers RTO further", "status": "V" }, { "ref": "LTM", "status": "LTM heuristic", "reasoning": "Under 15 minutes leaves no time to scale a reduced standby reliably; a full-capacity standby is the lowest-cost pattern that meets it. Active-active is offered only as a business choice (businessChoices)." } ] },
      { "answer": "15-60 minutes", "minMinutes": 15, "maxMinutes": 60, "rung": "DR-03",